{
  "$schema": "https://agent-plugins.org/schemas/1.0.0/plugin.schema.json",
  "name": "output-styles",
  "version": "0.1.0",
  "description": "Built-in output styles for DeepSeek Harness sessions: the default that adds nothing, an explanatory style that teaches as it works, and a concise style that answers first.",
  "author": { "name": "dsh-agent-plugins contributors" },
  "license": "MIT",
  "keywords": ["dsh", "output-styles", "concise", "explanatory"],
  "extensions": {
    "com.deepseek.harness": {
      "schemaVersion": "1.0.0"
    }
  }
}
